{
  "schemaVersion": 1,
  "contractId": "budget-sweep-result",
  "geometryId": "tokens-27000-vocab-8000",
  "points": [
    {
      "budgetBytes": 4096,
      "maximumUsefulCharge": "3072",
      "minimumRelayCharge": "24576",
      "relayCapacityCreditBytes": "15",
      "usefulFits": true,
      "relayBlocked": true,
      "classification": "pass"
    }
  ],
  "passingIntervals": [
    {
      "minimumBudgetBytes": 4096,
      "maximumBudgetBytes": 4096,
      "pointCount": 1
    }
  ],
  "minimumAdjacentPassingPoints": 3
}
